{
  "schema": "pliego.document-scene",
  "version": 1,
  "app_units_per_css_px": 60,
  "request_page": {
    "size": {
      "name": "A4"
    },
    "margins_app_units": {
      "top": 2880,
      "right": 2880,
      "bottom": 2880,
      "left": 2880
    },
    "geometry_authority": "request-only-v1"
  },
  "semantic_layer": null,
  "pages": [
    {
      "number": 1,
      "style_source": "request-defaults",
      "size_app_units": {
        "width": 47622,
        "height": 67351
      },
      "margins_app_units": {
        "top": 2880,
        "right": 2880,
        "bottom": 2880,
        "left": 2880
      },
      "operations": [
        {
          "type": "text",
          "text": "Invoice",
          "font": {
            "resource": "sha256:bf0cf8c8fff21d37f18617edb5677ed60cd2ea9dae07bfc8571d9f11da706a00",
            "face_index": 2,
            "variations": [
              {
                "tag": 2003265652,
                "value_f32_bits": 1137180672
              }
            ],
            "synthetic_bold": true
          },
          "font_size_app_units": 1080,
          "color": {
            "r": 0,
            "g": 0,
            "b": 0,
            "a": 255
          },
          "glyphs": [
            {
              "id": 42,
              "x": 2880,
              "y": 4320,
              "advance": 3240,
              "text_range": {
                "start": 0,
                "end": 7
              }
            }
          ]
        },
        {
          "type": "path",
          "bounds": {
            "x": 2880,
            "y": 5760,
            "width": 41862,
            "height": 60
          },
          "data": "M 2880 5760 L 44742 5760 L 44742 5820 L 2880 5820 Z",
          "fill": {
            "r": 64,
            "g": 64,
            "b": 64,
            "a": 255
          },
          "fill_rule": "non-zero"
        },
        {
          "type": "image",
          "bounds": {
            "x": 2880,
            "y": 7200,
            "width": 3840,
            "height": 3840
          },
          "resource": "sha256:2fae544893c4d6cdb5e76b60c9a0395b828b2b76a9bdbcd498b2392d9179758a",
          "media_type": "image/png"
        },
        {
          "type": "link",
          "bounds": {
            "x": 2880,
            "y": 12000,
            "width": 7200,
            "height": 1080
          },
          "target": "https://example.test/invoices/42"
        }
      ]
    }
  ]
}
